1. Who is the statutory auditor with respect to accounts of the Government Companies?,(a) CAG,(b) Board of Management,(c) Chartered Accountant appointed by the CAG,(d) Chartered Accountant appointed by the Board of Management,C,
" 119. Where the team audits income or expenditure or receipts and payments figures at an interim date, it can adopt audit approaches to the remainder of the accounting period at the time of final audit ","(a) place reliance on controls, together with a minimum level of substantive procedures",(b) perform a standard level of substantive procedures. ,(c) Both a and b ,(d) either a or b,D,
 120. Detailed audit programmes explaining the procedures to be followed by the audit team in order to implement the chosen audit approach should be prepared,(a) before determining audit approach but after preparing audit planning memorandum ,(b) after determining audit approach and preparing audit planning memorandum ,(c) before determining audit approach and preparing audit planning memorandum ,(d) after determining audit approach but before preparing audit planning memorandum,B,
" 121. In the case of State Government Accounts, the planning should cover the",(a) central audit function,(b) Central Audit and local audit functions ,"(c) Central Audit, local audit and information technology audit functions",(d) Central Audit and information technology audit functions,C,
" 122. Pick the correct ones i. In the case of Union Government Accounts, the three Offices of Director General Audit (Central Revenues), Principal Director of Audit (Economic and Service Ministries) and Principal Director of Audit (Scientific Departments) should prepare Audit Plans in respect of financial audit of the Departments covered by their respective offices. ii. Where other Sub Auditors carry out the financial audit of some Departments and provide an audit certificate to the Principal Auditor (as in the case of Railways, Posts and Defence), the respective Sub Auditors should prepare their Audit Plans. iii. The Office of the Director General Audit (Central Revenues) may require other Sub Auditors and the Offices of the State Accountants General to carry out test audit of the transactions of field offices of the Union Government Ministries / Departments covered under their audit jurisdiction.iv. When the auditee entity falls under the audit jurisdiction of more than one audit office, the audit planning should be carried out by the primary auditor without the involvement of the sub-auditor.","(a) i, ii and iii ","(b) i, iii and iv ","(c) i, ii and iv ",(d) All of the above,A,
 123. Based on the planning process who may revise/ update auditee specific sub-directions to be issued to the statutory auditors in respect of supplementary audit of Government Companies?,"(a) Headquarter Officer, CAG ",(b) A.G concerned,(c) AG with the prior consent of the Headquarter,"(d) Headquarter Officer, CAG with prior consent of A.G concerned",B,
" 124. The letter sent by the A.G to the secretary / chief executive of the entity, communicating the launch of the audit along with the entity units tentatively selected for audit, respective responsibilities of Audit and the entity management, the time-frame for audit and request him/her to issue necessary directions to the functional officers and field units to provide documents is called",(a) Letter of Understanding ,(b) Engagement Letter ,(c) Letter of Understanding for statutory financial attest audit and Engagement Letter for and non-statutory audit,(d) Engagement Letter for statutory financial attest audit and Letter of Understanding for non-statutory audit,C,
" 125. Pick the correct one regarding the reliability of audit evidencei. Evidence, of which the auditor has direct personal knowledge, is the most reliable evidence.ii. Independent evidence obtained from external sources is more reliable than internal evidence (obtained from the audited entity) if that evidence is truly independent and complete.iii. Visual evidence is highly reliable for confirming the existence of assets as well as their ownership and value. iv. Drawing conclusions solely through examining relationships between figures in the account (analytical review) is less reliable evidence.","(a) i, ii and iv ","(b) i, ii and iii ","(c) ii, iii and iv ",(d) All of the above,A,
 126. Pick the correct one regarding reasonable audit evidence ,(a) Reasonable audit evidence is information that is economical in that the cost of gathering it is commensurate with the result that the auditor is trying to achieve. ,"(b) Generally, audit evidence is persuasive rather than conclusive and, for this reason, the auditor should seek evidence from different sources or of a different nature to support the same audit objective.",(c) None of the given,(d) Both a and b,D,
 127. Pick the incorrect one ,(a) Audit should ensure that evidence obtained from deliberations or interviews with executives is documented and signed by both the participating audit personnel and executives. ,(b) Interview substitute the direct audit procedure and therefore evidence gathered is not required to be cross-checked through verification of records. ,"(c) In auditing government accounts, evidence may not be obtained by making independent enquiries from private individuals or members of the general public ",(d) Evidence may be gathered by enquiry from third parties through a reputed agency only when Audit is of the view that the evidence gathered directly from the auditee organisation is insufficient to arrive at proper conclusions.,B,
 128. How may testing control approaches are there in financial attest audit? ,(a) five,(b) four ,(c) three,(d) two,D,
 129. Pick the correct about testing control methods,(a) enquiry and confirmation ,(b) observation.,(c) sampling ,(d) All of the above,D,
 130. The failures of key controls should be reported to,(a) management through management letter ,(b) Government through letter of understanding ,(c) Parliament/Legislature as the case may be ,(d) All of the above.,A,
" 131. Before sampling any transactions the auditors should carry out a preliminary review of the listing of population items, which should include the application of planning analytical procedures and the same is intended to i. establish that the sampling frame the auditors intend to sample from does, in fact, match the planning expectations (for example, in terms of completeness) ii. contribute to auditors’ judgement as to where the main sensitivities or risks are in the population iii. provide an analysis of the population, as a basis for grouping the population by transaction type or value iv. allow auditors to determine our sampling methodology and enable auditors to decide which sampling unit should be tested","(a) i, ii and iii ","(b) ii, iii and iv ","(c) i, ii and iv ",(d) All of the above.,D,
 132. An error which will only occur in defined circumstances and hence affects only a proportion of the population is ,(a) random error ,(b) planned error,(c) systematic error,(d) unexpected error,C,
 133. An error which could have also occurred in any of the transactions that were not selected for testing is ,(a) unexpected error,(b) random error,(c) planned error ,(d) systematic error,B,
" 134. If the Accountant General concludes that the tests of detail do not indicate material misstatement or irregularity in any account area, then he",(a) may not take the planned level of substantive assurance ,(b) may take the planned level of substantive assurance ,(c) may revise the audit approach,(d) All of the above,B,
" 135. i. If the A.G concludes that there is material misstatement in the financial statements, then he should request the auditee entity to make appropriate disclosures in or adjustments to the financial statements. Ii. Where they do not agree to make appropriate disclosures in or adjustments to the financial statements, then the Accountant General should propose a qualified opinion. iii. If the Accountant General concludes that there is material irregularity then he should propose a qualified opinion, if the irregularity is not capable of correction by management. iv. Sometimes, the Accountant General may conclude that material misstatement or irregularity might be present, but he is unable to quantify it. This would usually occur due to a limitation on the scope of work. In such a situation, he may propose a disclaimer of opinion.","(a) i, ii and iii ","(b) ii, iii and iv ","(c) i, ii and iv ",(d) All of the above,D,
 136. Which is regarded as an opportunity for the entity to discuss the audit findings with the audit representatives. This also affords opportunity to the audit officer/group supervisory officer to clarify any points of doubt that the entity may like to raise?,(a) Exit conference,(b) Entry Conference,(c) Settlement Conference ,(d) Review Conference,A,
137,"(a) The audit working papers should document the audit procedures undertaken, the conclusions drawn and the implications for the audit opinion. They should record the reasoning on all significant matters where the members of the audit teams have exercised judgment. ",(b) The audit working papers help individual audit team members ensure that they have completed all the work necessary and provide the evidence to back up the opinion reached and allow review of the audit work to be carried out. ,(c) both a & b ,(d) None of the above,C,
 138. The acid test for good documentation is that,"(a) an experienced auditor with no previous connection with the audit should be able, without difficulty, to ascertain the evidence gathered and understand and support the conclusions reached ","(b) an experienced auditor with previous connection with the audit should be able, without difficulty, to ascertain the evidence gathered and understand and support the conclusions reached ","(c) an unexperienced auditor with no previous connection with the audit should be able, without difficulty, to ascertain the evidence gathered and understand and support the conclusions reached ","(d) an unexperienced auditor with previous connection with the audit should be able, without difficulty, to ascertain the evidence gathered and understand and support the conclusions reached",A,
" 139. Quality in fieldwork is assured through i. Adherence to the Field Standards and policy of the CAG regarding fieldwork ii. Ensuring staffing of audit teams with persons possessing appropriate knowledge and skills iii. Increase participation of the auditee entity in the course of audit iv. Supervision, monitoring and reviewv. Peer review. ","(a) i, ii, iii and iv ","(b) i, ii, iv and v","(c) i, ii and iv ",(d) All of the above,B,
" 140. The review of the procedures and practices by a professional, who has not been associated with the specific audit with a view to ensuring that the best practices and standards have been followed is called",(a) Cadre Review ,(b) Associate Review,(c) Peer Review ,(d) Supplementary Review,C,
 141. Subsequent events are those relevant events which occur and those facts which are discovered after the close of the period covered by the financial statements under audit and before the date of the audit certificate and are of ,(a) favourable nature,(b) unfavourable nature,(c) either favourable or unfavourable nature ,(d) None of the given.,C,
" 142. Procedures to identify subsequent events are: i. making enquiries of management to ascertain their procedures for identifying subsequent events ii. reading minutes of management meetings and board meetingsiii. reviewing the latest available financial information such as post period accounts, budgets and management information iv. obtaining revised guidelines from Headquarters Office v. considering Parliamentary or State Legislature proceedings occurring after the period end which might have an impact on the auditee. ","(a) i, iii, iv and v ","(b) ii, iii, iv and v ","(c) i, ii, iii and iv ","(d) i, ii, iii and v",D,
 143. The audit team should ensure that it has considered the auditee’s ability to continue as a going concern in the foreseeable future at,(a) completion stage,(b) execution stage,(c) planning stage,(d) post-completion stage,A,
" 144. State whether true or false: In the context of auditing the accounts of Governments, all the Government Departments can be considered as going concerns",(a) True,(b) False,,,A,
 145. Management representations are usually sought for the reasons except ,(a) where knowledge of the facts pertaining to a matter is confined to management alone ,(b) to acknowledge management's responsibility for the regularity of expenditure ,(c) to acknowledge management's responsibility for the preparation of the financial statements. ,(d) None of the above,D,
 146. Pick the incorrect one ,"(a) Before beginning, the audit procedures, the audit team should prepare an executive summary of audit findings.","(b) This summary explains the key audit issues, their resolution, agreed adjustments and concludes on the appropriate form of audit certificate.","(c) The summary is reviewed and signed by the Audit Officer, Group Officer (supervising the audit) and Accountant General. ",(d) None of the given,A,
" 147. The executive summary should include i. a summary of the auditee's operations and purpose, the regularity framework within which the auditee operates, the key risks identified and audit issues and their resolution. ii. a commentary on the expenditure and income of the auditee, key balances, unadjusted error and accounting policies in significant account areas iii. details of areas where difficult questions of principle or judgement were involvediv. conclusion on the appropriate form of audit certificate. ","(a) i, ii and iii ","(b) ii, iii and iv","(c) i, iii and iv ",(d) All of the above,D,
" 148. The full rationale should be given in the executive summary, where the proposed audit certificate will be ",(a) other than qualified,(b) other than unqualified,(c) other than disclaimer,(d) other than adverse.,B,
" 149. Effective documentationsi. confirm, support the auditor's opinions and reports and help the auditor's professional development. ii. serve as a source of information for preparing reports or answering any enquiries from the audited entity or from any other party and increase the efficiency and effectiveness of the audit; iii. serve as evidence of the auditor's compliance with Auditing Standards, facilitate planning and supervision and help to ensure that delegated work has been satisfactorily performed iv. save the auditor from audit procedures at planning stage in audits of ensuing years.","(a) ii, iii and iv ","(b) i, ii and iv ","(c) i, ii and iii ",(d) All of the above.,C,
 150. The method of filing documents should recognise that documents fall into category ,"(a) those relevant to the audit of the entity (Government, Department etc. under audit) generally ","(b) those relevant only to the audit of the entity (Government, Department etc. under audit) for a particular year of account ",(c) Both a & b ,(d) None of the given,C,
" 151. The documents to which the auditor needs to refer each year should be placed in a Standing File. This file should contain current information about the organisation itself, such asi. the authority for the audit ii. List of key audit personnel iii. governing legislation iv. organisation’s chart and key personnel v. descriptions of accounting systems and manualsvi. systems evaluations","(a) i, ii, iii, iv and v","(b) i, iii, iv, v and vi ","(c) ii, iii, iv, v and vi",(d) All of the above.,B,
 152. The working paper folders should include documentation which shows i. the names of audit personnel who carried out the audit work ii. the dates when the audit work was carried out by the respective audit personnel iii. the sources of the information / evidence obtained iv. the nature and purpose of the audit tests carried out and the results obtained ,"(a) i, ii and iii ","(b) ii, iii and iv","(c) i, iii and iv ",(d) All of the above.,D,
 153. The broad characteristics of a good working paper arei. Completeness and accuracy ii. Clarity and concisenessiii. Ease of preparationiv. Persistency and continuity ,"(a) i, ii and iii ","(b) ii, iii and iv","(c) i, ii and iv ",(d) All of the above,A,
 154. Who shall be responsible for documenting a good working in following standards?,(a) Audit Officer,(b) Group Officer ,(c) Audit Officer and Group Officer individually and jointly,(d) Audit Officer and Group Officer jointly,C,
 155. What is TeamMate?,(a) an electronic audit sampling software,(b) an electronic documentation software,(c) an electronic audit procedure and method software,(d) an electronic audit reporting software,B,
 156. Account Area Lead Schedule pertaining to financial attest audit is,(a) reviewed by the Audit officer in charge of certification of financial statement and approved by the Group Officer concerned,(b) reviewed and approved by the Group Officer in charge of certification of financial statement,(c) reviewed by the Group Officerin charge of certification of financial statement and approved by the Accountant General ,(d) reviewed by the Audit Officer/Group Officerin charge of certification of financial statement and approved by the Accountant General,D,
" 157. State whether true or false:  Generally, the audit reports on completion of financial audit will be in the form of audit certificates. However, in appropriate cases, a detailed report can be annexed to the audit certificate. ",(a) True,(b) False,,,A,
 158. The general principles of reporting standard arei. Titleii. Signature and date.iii. Objectives and scopeiv. Completeness. v. Addresseevi. Identification of subject matter,"(a) i, ii, iii, iv and v","(b) i, iii, iv, v and vi ","(c) ii, iii, iv, v and vi",(d) All of the above.,D,
 159. The audit opinion will also contain separate sections dealing with except,(a) respective responsibilities of the executive and auditors,(b) the basis of the opinion expressed,(c) remedial action taken or proposed by executive ,(d) the opinion on the financial statements,C,
" 160. In States where the Finance and Appropriation Accounts are compiled by the AG (A&E), primarily responsible for the correctness of the initial and subsidiary accounts as well as ensuring the regularity of financial transactions in accordance with the applicable laws, standards, rules and regulations concerning such accounts and transactions is",(a) the AG (A&E) ,(b) the State Government,"(c) treasuries, offices or departments functioning under the State Government",(d) All of the above.,C,
" 161. The audit certificate should include a statement expressly setting out the basis of the audit opinion. This will include i. a statement certifying that the C&AG has performed his examination in accordance with relevant legislative authority - where there is a legal requirement for him to certify; ii. a statement as to compliance or otherwise with Auditing Standards, together with the reasons for any departure therefrom; iii. a statement that the audit process includes examining, on a test basis, evidence relevant to the amounts, disclosures and regularity of transactions included in the financial statements; and iv. a statement that the audit is planned and performed so as to obtain reasonable assurance that the financial statements are free from material misstatement ","(a) i, ii and iii ","(b) ii, iii and iv ","(c) i, ii and iv ",(d) All of the above.,D,
" 162. When, in the judgement of the Accountant General, the financial statements properly present receipts and payments or give a true and fair view and have been prepared in accordance with relevant accounting requirements, the opinion given will be",(a) qualified,(b) unqualified ,(c) disclaimer ,(d) adverse,B,
" 163. Before forming the unqualified opinion, the Accountant General must be satisfied thati. the financial statements have been prepared in accordance with relevant legislation, regulations, instructions of Finance Department, Government Accounting and applicable accounting standards. Any departures are justified and adequately explained in the financial statements ii. there is adequate disclosure of all information relevant to a proper understanding of the financial statements iii. appropriate accounting policies have been consistently applied in the preparation of financial statements. iv. the financial statements are free from material irregularity and therefore that the transactions recorded in them conform with the authority which governs them.","(a) ii, iii and iv ","(b) i, ii and iii ","(c) i, iii and iv ",(d) All of the above,D,
" 164. In forming the judgement about absence of material irregularity, the Accountant General must be satisfied that in all material respects i. transactions comply with the legislation (both primary and secondary) governing them ii. transactions comply with any regulations relating to them issued by a body with the power to do so under the governing legislation; iii. approval of Finance Department or any sponsoring Department has been sought and obtained as required; iv. the financial transactions do not fall within the ambit of the Vote of the Parliament or Legislature. ","(a) i, ii and iii ","(b) ii, iii and iv","(c) i, iii and iv ",(d) All of the above,A,
" 165. Where the Accountant General is unable to satisfy himself that the financial statements are free from material misstatement whether caused by fraud, error or other irregularity, the opinion given will be ",(a) disclaimer ,(b) unqualified ,(c) qualified ,(d) adverse,C,
 166. Opinion to be given on all Excess votes for Appropriation Accounts will be,(a) adverse ,(b) qualified ,(c) unqualified ,(d) disclaimer,B,
 167. Three types of opinion other than unqualified can be issued are except ,(a) except for ,(b) adverse ,(c) disclaimer ,(d) unacceptable.,D,
 168. The manner in which the Accountant General qualifies his opinion depends on,(a)which of the groups the qualification falls into: uncertainty or disagreement ,(b) the strength of the qualification ,(c) Both a & b ,(d) None of the given,C,
" 169. i. The Accountant General should not sign the certification journal until the financial statements and all other financial information contained in a report of which the audited financial statements form a part have been approved by the accounting officer, board, or equivalent persons. ii. Normally, the audit certificate should be positioned immediately after the financial statements and immediately before the statement of executive’s/directors'/management’s responsibilities. iii. The date of a certificate on financial statements is the date on which the C&AG, or his delegate, signs his report expressing his opinion on those statements. iv. The C&AG will personally sign certificates on financial statements with the exception of those where he has delegated the responsibility of signing to another Officer","(a) i, ii and iii ","(b) i, iii and iv ","(c) ii, iii and iv ",(d) All of the above,B,
 170. i. The recommendations to the auditee towards improvement in their financial management and controls would be auditor’s value addition in the overall financial management on completion of financial attest audit is communicated to the management through Management Letter.ii. The Management Letter is distinct from and issued in place of the inspection reports after the completion of transaction audit. iii. It should be ensured that the facts presented are correct and the recommendations are realistic and cost-effective. iv. Audit must ensure that nothing communicated to the auditee entity is inconsistent with the audit opinion.,"(a) i, iii and iv ","(b) i, ii and iv ","(c) ii, iii and iv ",(d) All of the above,A,
 171. Pick the incorrect one regarding submission of report,(a) Article 151- to the President of India relating to the accounts of the Union,(b) Article 152- to the Governor of the State relating to the accounts of the State ,"(c) Section 49 of the Government of Union Territories Act, 1963- to the Administrator relating to the accounts of the UT having a Legislative Assembly ",(d) None of the given,B,
 172. State whether true or false: The C&AG will personally sign certificates on financial statements with the exception of those where he has delegated the responsibility of signing to another Officer,(a) True,(b) False,,,A,
" 173. The Section of the DPC Act, 1971 that authorises the CAG to delegate any power exercisable by the CAG under the provisions of the Act, or any other law, to any officer of his department, by general or special order is",(a) Section 22 ,(b) Section 24,(c) Section 21 ,(d) Section 23,C,
 174. Authorised for Submission of the report to the President/Governor/Administrator,(a) CAG alone in all the case ,(b) Any authority power to whom delegated by the CAG,(c) Any authority so authorised in case of CAG’s absence on leave or otherwise,(d) Any authority so authorised by the Union Government in consultation with the CAG.,C,
 175. Pick the incorrect one ,(a) Supervision is a day-to-day control to ensure that the audit proceeds satisfactorily and that any problems are immediately attended to. ,(b) Review can take place in stages during the progress of work and after its completion. ,"(c) According to the field standards in the Auditing Standards of the CAG, the work of the audit staff at each level and audit phase should be properly supervised during the audit, and a senior member of the audit staff should review documented work. ",(d) None of the given,D,
