1. The Audit and Accounts Regulations has been issued in pursuance of ,(a) Section 21 of the DPC Act ,(b) Section 22 of the DPC Act ,(c) Section 23 of the DPC Act ,(d) Section 24 of the DPC Act,C,
2. The Audit and Accounts Regulations apply to ,(a) Officers and staff of the IA&AD ,"(b) All ministries and departments of the Union Government, State Governments and Union Territory Governments ","(c) Bodies, authorities and enterprises, to which the audit or accounts jurisdictions of the CAG of India extend ",(d) All of the given.,D,
3. The Audit Board is constituted by the CAG for performance audits of ,(a) Central Public Sector Undertakings ,(b) Government Companies ,(c) Ministries and Departments including autonomous bodies ,(d) All of the above,A,
4. Pick the incorrect one ,"(a) Audit Memorandum- a letter issued during the course of audit for eliciting information, confirmation of facts or any other matter considered necessary by the audit officer in conduct of audit ","(b) Statutory Audit Report- an audit report containing audit observations on the accounts of an authority, body or corporation whether or not required to be laid before the legislature ","(c) Audit note- a note issued by an audit office containing the results of audit conducted with reference to data, information or documents available in an audit or accounts office ","(d) Practice notes- the detailed instructions on audit or on accounting matters in consistent with the Regulations, standing orders and guidelines issued by the CAG.",B,
5. Submission of audit report by the CAG is governed by ,(a) Article 149 of the Constitution ,(b) Article 152 of the Constitution ,(c) Article 150 of the Constitution ,(d) Article 151 of the Constitution,D,
6. Who constitutes the Audit review Committee? ,(a) the Accountant General ,(b) the CAG ,(c) the Union Government ,(d) the State Government,A,
7. Audit review Committee is constituted for ,(a) review the implementation and working of Technical Guidance Support scheme ,"(b) advising the Accountant General on special and important audit topics pertaining to Central, State and UT governments ",(c) for finalisation of performance audits of State Public Sector Enterprises ,(d) All of the above,C,
"8. The broad objectives of audit are to ensure legality, regularity, economy, efficiency and effectiveness of financial management and public administration mainly through assessment as to ","(a) whether the financial statements are properly prepared, are complete in all respects and are presented with adequate disclosures ","(b) whether the provisions of the Constitution, the applicable laws, rules and regulations made thereunder and various orders and instructions issued by competent authority are being complied with ","(c) the extent to which an activity, programme or organisation operates economically, efficiently and effectively. ",(d) All of the above,D,
9. Audit has been categorised into three class. Pick the incorrect one ,(a) Compliance Audit ,(b) Financial Audit ,(c) Performance Audit ,(d) Supplementary Audit,D,
"10. The person in charge of any office or department, the accounts of which have to be inspected and audited by the Comptroller and Auditor General, shall afford all facilities for such inspection and comply with requests for information in as complete a form as possible and with all reasonable expedition under the provision of ",(a) Section 18 of DPC Acts ,(b) Section 19 of DPC Acts ,(c) Section 17 of DPC Acts ,(d) Section 15 of DPC Acts,A,
"11. Pick the correct one i. Auditors should ordinarily not become members of management committees and if advice is to be given, it should be conveyed as audit advice or recommendation and acknowledged clearly as such ii. Audit should be ready to advise the executive in such matters as accounting standards and policies, the form of financial statements and alternative ways of execution of policies to attain efficiency, effectiveness and economy. iii. There is no power of direction by the executive in relation to the performance of the audit mandate. iv. The CAG may, in special circumstances and if so required, utilise specialised skills from external sources in carrying out an audit or accounts task ","(a) i, ii and iii ","(b) i, ii and iv ","(c) i, iii and iv ",(d) All of the above,C,
12. Extent of audit means ,(a) the quantum of audit including the period ,(b) the units of the auditable entity ,(c) the extent of test check and the boundaries of audit enquiry to be covered in an audit. ,(d) All of the above,D,
"13. When circumstances so warrant, dispense with any part of detailed audit of any accounts or class of transactions and apply such limited check in relation to such accounts or transactions as he may determine under the provision of ",(a) Section 23 of DPC Act ,(b) Section 24 of DPC Act ,(c) Section 22 of DPC Act ,(d) Section 26 of DPC Act,B,
14. Audit will be conducted ,"(a) with reference to such accounts, vouchers and records as may be received in the audit office and/or in the accounts office and may include online data, information and documents of the auditable entity ",(b) in the office of the auditable entity or at the site where the relevant records for audit are available or at such other place as may be decided by Executive/Auditee unit. ,(c) Both a & b ,(d) None of the given,A,
"15. The CAG or any officer so authorised shall give due consideration to a request for special audit of a programme, project or organisation within the audit jurisdiction provided that every such request i. is made with the approval of the Cabinet/Chief Secretary to Government. ii. shall state the justification and reasons that necessitate a special audit, including the results of any preliminary inquiry, investigation or study that may have already been conducted; and iii. specify the period to be covered in the special audit. iv. The decision of the CAG or any officer so authorised in regard to the special audit shall be final. ","(a) i, ii and iii ","(b) i, ii and iv ","(c) ii, iii and iv ",(d) All of the above,C,
16. The norms which the auditors are expected to follow in conduct of audit and provide guidance to the auditor to help determine the auditing steps and procedures that should be applied in audit and constitute the criteria or the yardstick against which quality of audit results is evaluated ,(a) Audit norms ,(b) Audit Standards ,(c) Audit Manual ,(d) Accounting Standards,B,
17. The auditing standards include the i. Basic postulates ii. General standards iii. Field standards iv. Reporting standards ,"(a) i, ii and iii ","(b) ii, iii and iv ","(c) i, iii and iv ",(d) All of the above,D,
"18. Match the following Standard-->  Brief Description: A: Basic Postulates; B: General Standards; C: Field Standards; D: Reporting Standards;  I: establish a foundation for credibility of work of the auditor and the audit institution.;  II: provide an overall framework for the auditor and the audit institution for reporting the results of audit;  III: help in developing auditing standards and guide the auditors in forming their opinions and reports, particularly in cases where no specific standards apply;  IV: provide an overall   framework   for   conducting   and managing an audit.; ","(a) A-I, B-II, C-III and D-IV ","(b) A-II, B-I, C-IV and D-III ","(c) A-III, B-I, C-IV and D-II ","(d) A-IV, B-III, C-II and D-I",C,
"19. Basic postulates includes i. The auditing standards shall be complied with by the auditors in all matters that are deemed material. ii. The auditors shall apply their own judgement to the diverse situations that arise in the course of audit. iii. The CAG or his officers shall ensure the promulgation of acceptable accounting standards for financial reporting and disclosure that are relevant to the needs of the Government and that result in true and fair presentation of financial position and results of operations. iv. The Government shall ensure cooperation of auditable entities in providing access to all relevant data, information and documents necessary for audit ","(a) i, ii and iv ","(b) ii, iii and iv ","(c) i, ii and iii ",(d) All of the above.,A,
20. Audit shall avoid conflict of interest between the auditor and the auditable entity is a located in ,(a) Reporting Standard ,(b) Field Standard ,(c) General Standard ,(d) Basic Postulate,D,
"21. Who shall be responsible for establishment, development and enforcement of adequate information, control, evaluation and reporting systems within the Government to facilitate the accountability process? ",(a) the CAG ,(b) the Government ,(c) Auditee unit ,(d) All of the above,B,
"22. Which describes the qualifications of the auditor and the audit institution, the compliance of which enables them to carry out the tasks related to conduct of audit and reporting of audit findings in a competent and effective manner? ",(a) Basic Postulates ,(b) General Standards ,(c) Field Standards ,(d) Reporting Standards,B,
23. The general standards include i. Independence ii. Professional Competence iii. Due care iv. Professional Judgement v. Quality Control ,"(a) i, ii, iii and iv ","(b) i, iii, iv and v ","(c) ii, iii, iv and v ",(d) All of the above,D,
24. Due care element of general standards means ,"(a) The auditors should exercise due care and caution in complying with auditing standards particularly in planning audits, specifying, gathering and evaluating evidence and in reporting findings, conclusions and recommendations ","(b) The auditee institutions should exercise due care in providing all records, documents and information requisitioned by the auditors during the course of audit. ",(c) Both a & b ,(d) None of the given,A,
25. Professional Competence is applicable to ,(a) the auditors ,(b) the audit institutions ,(c) the auditors and the auditee institutions ,"(d) the auditors, the auditee institutions and auditee units",C,
26. Pick the correct one ,"(a) Professional judgement represents the application of the individual knowledge, skills and experience of an auditor involved with an assignment and not the collective the professional judgement of the all the personnel involved with an assignment.","(b) Professional judgement represents collaboration with other stakeholders, outside experts and the management in the audit institution. ",(c) Both a & b ,(d) All of the above,B,
"27. State whether true or false: Separate field standards may be formulated for financial audit, compliance audit and performance audit. ",(a) True ,(b) False,,,A,
28. Field audit standards are related to ,(a) General Standards ,(b) Reporting Standards ,(c) Both a & b ,(d) None of the given,C,
"29. The elements of the field audit standards are i. Planning ii. Supervision and review iii. Examination and evaluation of internal control iv. Compliance with applicable laws, rules and regulations v. Audit evidence ","(a) ii, iii, iv and v ","(b) i, iii, iv and v ","(c) i, ii, iii and iv ",(d) All of the above,D,
30. Audit evidence should be ,"(a) Complete, Relevant and Reliable ","(b) Competent, Relevant and Reasonable ","(c) Compact, Reliable and Reasonable ","(d) Concise, Relevant and Reliable",B,
"31. Reporting standards include element i. Reporting standards shall be meant to assist, and not to supersede, prudent judgement of the auditor in framing and reporting audit findings, conclusions and recommendations. ii. The reports should be complete, accurate, objective, convincing, clear, concise, constructive and timely. iii. In formulating the audit opinion or report, the auditor should inter alia give due regard to the materiality of the matter keeping in view the amount, nature and context iv. Performance audits, besides reporting on individual cases of non-compliance and abuse, also require reporting on weaknesses that exist in systems of financial management and internal control ","(a) i, ii and iii ","(b) i, ii and iv ","(c) ii, iii and iv ",(d) All of the above,A,
32. The form and content of all audit opinions and reports need to be consistent with the principles of i. objectives and scope ii. Completeness iii. addressee iv. timeliness. ,"(a) i, ii and iii ","(b) i, ii and iv ","(c) ii, iii and iv ",(d) All of the above,D,
33. State whether true or false: The CAG examines and certifies the Finance Accounts and the Appropriation Accounts of the Union and the Accountant General (Audit) of the State and the Union Territory having a legislative assembly certifies the Finance Accounts and the Appropriation Accounts of the State and UT concerned ,(a) True ,(b) False,,,B,
"34. Reports pertaining to which types of audit should not concentrate solely on adverse assessment of the past but should be constructive. Recommendations should, as far as feasible, suggest what improvements are needed and how to achieve them? ",(a) Compliance Audit ,(b) Financial Audit ,(c) Performance Audit ,(d) Supplementary Audit,C,
35. The primary purpose of financial audit is to verify except ,(a) whether the accounts of Government are properly prepared ,(b) whether the accounts of Government ,(c) whether the accounts of Government are complete in all respects and are presented with adequate disclosures. ,(d) None of the given,D,
36. Pick the incorrect one ,(a) Government departments shall send copies of all orders of re-appropriation and surrender of funds to the audit office and the accounts office as soon as these are issued ,(b) A consolidated statement of all such orders issued during a financial year shall also be sent to the audit office and the accounts office so as to reach within 15 days after the close of the financial year. ,(c) A nil statement shall be sent if no such order was issued ,(d) None of the given,B,
"37. Government departments and the agency responsible for the compilation of accounts and financial statements shall supply to the audit officer i. the reasons for any significant variations between the amounts of expenditure and the amounts of receipts of the year of accounts and the corresponding amounts for the preceding year ii. the statement of periodic book adjustments together with the copies of the general or special orders authorising such adjustments iii. the explanation for differences, if any, in the cash balance as per the books of accounts and the balance as per the books of the Reserve Bank of India iv. the explanation for any items that are prima facie unusual including adverse and insufficient balances ","(a) ii, iii and iv ","(b) i, ii and iv ","(c) i, ii and iii ",(d) All of the above,D,
"38. Government departments and the agency responsible for the compilation of accounts and financial statements shall supply to the audit officer i. details of the outstanding amounts of loan and interest on loans. ii. details of guarantee given, guarantee invoked and guarantee fee received during the year iii. the details of complete works costing more than the limit prescribed by the audit office from time to time iv. the reasons for variations, if any, between the closing balances of the preceding year and the opening balances of the year of accounts in respect of heads of accounts that do not close to Government account; ","(a) ii, iii and iv ","(b) i, ii and iv ","(c) i, ii and iii ",(d) All of the above,B,
39. An annual action plan for the timely completion of certification of financial statements shall be prepared by ,(a) Audit Office ,(b) agencies responsible for preparation and compilation of accounts ,(c) Audit Office and agencies responsible for preparation and compilation of accounts ,"(d) Audit Office, agencies responsible for preparation and compilation of accounts and the Government concerned",C,
40. Compliance audit examines the transactions relating to ,(a) expenditure and receipts ,(b) assets and liabilities ,"(c) expenditure, receipts and assets and liabilities ","(d) expenditure, receipts, assets and liabilities and performance of the entity",C,
"41. Compliance audit examines the transactions relating to expenditure, receipts, assets and liabilities of Government for compliance with ",(a) the provisions of the Constitution of India and the applicable laws ,"(b) the rules, regulations, orders and instructions issued by the competent authority either in pursuance of the provisions of the Constitution of India and the laws or by virtue of the powers formally delegated to it by a superior authority. ",(c) Neither a nor b ,(d) Both a and b,D,
42. Pick the correct one ,"(a) Government departments shall invariably endorse or otherwise send to the audit office(s) and the accounts office(s) copies of all rules, regulations and general orders regulating the raising of revenues, incurring of expenditure and liabilities and management of assets and liabilities, as soon as these are issued. ","(b) Wherever possible, any revision of rules or substantive codes undertaken by the Government departments and having financial, accounting or auditing implications may be referred to the concerned Accountant General (Accounts and Entitlement) or Accountant General (Audit), as the case may be, for scrutiny after issue. ",(c) Both a & b ,(d) None of the given,A,
43. The CAG has been authorised to audit all expenditure from the Consolidated Fund of India and of each State and of each Union Territory having a legislative assembly under the provision of ,(a) Section 12 of the DPC Act ,(b) Section 13 of the DPC Act ,(c) Section 15 of the DPC Act ,(d) Section 16 of the DPC Act,B,
"44. Audit checks the expenditure for i. Appropriation and re-appropriation and confirmation that the expenditure is within the scope and intent of the grant and does not attract the limitation of new service or new instrument of service ii. Authorisation by the authority that is competent to do so iii. Compliance with the requirement of the applicable laws, rules, regulations, orders and instructions in actual disbursement iv. Evidence by way of vouchers, payees’ acknowledgements etc.  ","(a) i, ii and iii ","(b) ii, iii and iv ","(c) i, iii and iv ",(d) All of the above,D,
"45. Audit checks the expenditure for i. Record in the books of the spending officer, including cross-verification with the records of the treasury, pay and accounts office, bank, etc.  ii. Identification of potential tax assessees, ensuring compliance with laws as well as detection and prevention of tax evasion; iii. Accounting in the books of the Government iv. Monitoring, control and reporting as prescribed in the Government rules. ","(a) i, ii and iii ","(b) ii, iii and iv ","(c) i, iii and iv ",(d) All of the above,C,
"46. Pick the correct one regarding Endorsement of copies of sanction orders and contract agreements to Audit i. Copies of all orders sanctioning expenditure issued by Government departments shall be endorsed or otherwise sent to the audit office as soon as these are issued. ii. Heads of departments shall also send to the audit office quarterly statements on the 15th day of following month of the quarter concerned of all sanctions issued in respect of their department during the preceding quarter. iii. Copies of contract agreements need to be sent to the audit office along with quarterly statements iv. The CAG, by a general or special order, may exempt any department or a particular class or classes of orders from the requirement of sending copies to audit office. ","(a) i, ii and iv ","(b) i, ii and iii ","(c) ii, iii and iv ",(d) All of the above,A,
"47. Who shall endorse or otherwise send to the audit office and the accounts office, copies of all sanctions of advance from the Contingency Fund as well as resumption of the advance to the Contingency Fund as soon as these are issued? ",(a) Finance Ministry/Department ,(b) President/Governor ,(c) Parliament/Legislature ,(d) Reserve Bank of India,A,
48. The CAG has been authorised to audit all receipts of the Government of India and of Governments of each State and of each Union Territory having a legislative assembly under the provision of ,(a) Section 12 of the DPC Act ,(b) Section 13 of the DPC Act ,(c) Section 15 of the DPC Act ,(d) Section 16 of the DPC Act,D,
"49. With regard to audit of receipts, the CAG has to satisfy himself that the rules and procedures are designed to secure an effective check on the ",(a) Assessment of revenue ,(b) Collection of revenue ,(c) Assessment and collection of revenue ,"(d) Assessment, collection and proper allocation of revenue",D,
"50. Audit of receipts includes an examination of the systems and procedures and their efficacy in respect of i. pursuit of claims with due diligence and that these are not abandoned or reduced except with adequate justification and proper authority ii. prompt investigation of losses of revenue through fraud, default or mistake including, if required, through the review of other similar cases iii. exercise of discretionary powers in an appropriate manner including levy of penalties and initiation of prosecution iv. achievement of targets, accounting and reporting of receipts and their cross-verification and reconciliation with the accounts records ","(a) i, ii and iii ","(b) ii, iii and iv ","(c) i, iii and iv ",(d) All of the above,D,
"51. Audit of receipts includes an examination of the systems and procedures and their efficacy in respect of i. appropriate action to safeguard the interests of the Government on the orders passed by departmental appellate authorities ii. amounts that may have fallen into arrears, maintenance of records of arrears and action taken for the recovery of the amounts in arrears iii. other ancillary and non-assessment functions including expenditure incurred by the departments iv. amounts of refunds, rebates, drawbacks, remissions and abatements to see that these are correctly assessed and accounted for v. any other matter, as may be determined by the Government ","(a) ii, iii, iv and v ","(b) i, ii, iii and iv ","(c) i, ii, iv and v ",(d) All of the above,B,
"52. An annual statement to the Accountant General (Audit) containing the details of follow up action taken on audit observations, including recoveries, in respect of accepted paragraphs included in the audit reports laid before Parliament or legislature till the end of that financial year shall be furnished by the department within ",(a) one month of the close of financial year ,(b) six months of the close of financial year ,(c) three months of the close of financial year ,(d) two months of the close of financial year,B,
53. The CAG to audit and report on the accounts of the stores and the stock kept in any office or department of the Union or of a State or of a Union Territory having a legislative assembly under the provision of ,(a) Section 17 of the DPC Act ,(b) Section 18 of the DPC Act ,(c) Section 19 of the DPC Act ,(d) Section 20 of the DPC Act,A,
54. The accounts of stores and stock shall be kept in the manner prescribed by ,(a) Head of the auditee unit ,(b) Parliament ,(c) the CAG in consultation with the Union Government ,(d) the Union Government in consultation with the CAG,D,
"55. State whether true or false: Audit shall not normally assume responsibility for physical verification of stores which rests with the Government. It, however, reserves the right to investigate store balances and highlight discrepancies. ",(a) True ,(b) False,,,A,
56. Pick the incorrect one ,(a) Audit of Store and Stock -Extension of audit of expenditure ,(b) Audit of Grant-in-aid- Extension of audit of receipt ,(c) Audit of Loans-Extension of audit of expenditure ,(d) All of the above,B,
"57. Audit of Government assistance in form of grants-in-aid or loans shall be conducted to verify whether systems and procedures are in place and are being complied with for i. proper and transparent identification and selection of persons, bodies and authorities for Government assistance with reference to their antecedents, absorptive capacity, financial position, systems and management practices ii. clear enunciation of purpose for the sanction of the Government assistance and determination of amount of assistance and its timely release iii. proper accounting of assistance by the grantee or the loanee including maintenance of accounts in such form as may be prescribed iv. monitoring and ensuring the economical, efficient and effective end use of assistance including achievement of the objectives of assistance ","(a) ii, iii and iv ","(b) i, ii and iii ","(c) i, iii and iv ",(d) All of the above,D,
58. Pick the correct one ,(a) Economy issues focus on the cost of the inputs and processes. Economy occurs where equal-quality resources are acquired at least cost. ,"(b) Efficiency is the relationship between the output, in terms of goods, services or other results and the resources used to produce them. ",(c) Effectiveness is the extent to which objectives are achieved and the relationship between the intended impact and the actual impact of an activity. ,(d) All of the above,D,
"59. Where the use of financial, human, physical and information resources is such that output is maximised for any given set of resource inputs, or input is minimised for any given quantity and quality of output, it leads to existence of ",(a) economy ,(b) effectiveness ,(c) efficiency ,(d) All of the above.,C,
"60. Which parameter addresses the issue of whether the scheme, programme or organisation has achieved its objectives? ",(a) economy ,(b) effectiveness ,(c) efficiency ,(d) All of the above.,B,
61. An Entry Conference shall be held before commencing detailed work of performance audit ,(a) by the AG with the Secretary to the Government of concerned department ,(b) by the Secretary to the Government of concerned department with the AG ,(c) by the AG with the Secretary to the Government of Finance department ,(d) by the Secretary to the Government of Finance department with the AG,A,
