1. Who is the statutory auditor with respect to accounts of the Government Companies?,(a) CAG,(b) Board of Management,(c) Chartered Accountant appointed by the CAG,(d) Chartered Accountant appointed by the Board of Management,C,
 2. Financial Statement of an autonomous body includesi. Trial Balance ii. Trading and Profit Accountiii. Income and Expenditure Accountiv. Balance Sheet ,(a) iii and iv ,"(b) ii, iii and iv","(c) i, iii and iv ",(d) All of the above,A,
 3. Financial statements include Appropriation and Finance Accounts pertaining toi. Central Governmentii. State Governmentiii. Union Territoriesiv. Externally Aided Project ,(a) All of the above,"(b) ii, iii and iv","(c) i, ii and iv ","(d) i, ii and iii",D,
" 4. Audit of all the expenditure from Consolidated Fund, Contingency Fund and Public Accounts is governed by which Section of the DPC Act, 1971? ",(a) Section 11 ,(b) Section 13,(c) Section 15 ,(d) Section 16,B,
 5. The audit of the accounts of authorities and bodies receiving financial assistance in the form of Grant-in-aid/loans from Government is carried out in accordance with the provision of ,(a) Section 13 and 16 of DPC Act ,(b) Section 14 and 15 of DPC Act,(c) Section 17 and 18 of DPC Act ,(d) Section 19 and 20 of DPC Act,B,
 6. Which section of the DPC Act deals with the audit of receipt of the Government?,(a) Section 13 ,(b) Section 15,(c) Section 16 ,(d) Section 19,C,
 7. Pick the correct one i. Financial Attest Audit is primarily concerned with expression of audit opinion on a set of financial statement ii. FAA includes Examination and evaluation of financial records and expression of opinion on Financial Statements iii. FAA includes audit of financial system and transactions including evaluation of compliance with applicable statutes and regulations which affect the accuracy and completeness of accounting records. iv.FAA includes audit of internal control and internal audit functions that assist in safeguarding assets and resources and assures the accuracy and completeness of accounting records.,"(a) i, ii and iii ","(b) i, iii and iv ","(c) i, ii and iv ",(d) All of the above.,D,
" 8. Which type of audit seeks to address the issues of risks to regularity, propriety and financial conrol?",(a) Transaction Audit,(b) Financial Audit,(c) Performance Audit,(d) All of the above.,A,
" 9. i. The opinion on financial statements provides a positive annual assurance on the financial statements to the Parliament or Legislature. ii. Transaction Audit conducted by the IA&AD is not linked to a specific assurance on an individual set of financial statements in a particular year.iii. Transaction Audit does not result in a formal audit opinion on financial statements but rather in reports either to management or Parliament or Legislature iv. Transaction Audit focuses on the Government Department or its units rather than on the financial statementsv. Financial Attest Audit does not cover all the units of Government Departments every year, but seeks to cover them over a period of time","(a) ii, iii, iv and v ","(b) i, iii, iv and v ","(c) i, ii, iii and iv ",(d) All of the above.,C,
" 10. State whether true or false:  Transaction Audit seeks to cover risks of significant irregularity, which may not be material for the purpose of qualifying audit opinion on the financial statements",(a) True,(b) False,,,A,
 11. The audit of the accounts of authorities and bodies receiving financial assistance in the form of grants and /or loans from the Government of India or a State or Union Territory has been provisioned in ,(a) Section 17 & 18 of the DPC Act,(b) Section 14 & 15 of the DPC Act,(c) Section 13 & 16 of the DPC Act,(d) Section 19 & 20 of the DPC Act,B,
" 12. Section 16 of the DPC Act, 971 requires the CAG to be satisfied that the rules and procedures in that behalf are designed to secure an effective check on the",(a) Assessment of revenue ,(b) Assessment & collection of revenue ,(c) Collection and proper allocation of revenue,"(d) Assessment, Collection and proper allocation of revenue",D,
" 13. Match the following A: Section of DPC Act Number-17; B: Section of DPC Act Number-18; C: Section of DPC Act Number-19; D: Section of DPC Act Number-20; I: To inspect any office of accounts under the control of the Union or of a State, including treasuries and such offices responsible for the keeping of initial and subsidiary accounts, as submit accounts to the CAG; II: Audit of the accounts of certain bodies or authorities, not covered by Section 19 or whose audit has not been entrusted by or under any law made by Parliament to the CAG can be entrusted to the CAG; III: Audit and report on the accounts of the stores and stock kept in any office or department of the Union or a State or a Union Territory.; IV: Duties and powers of the CAG in relation to the audit of the accounts of Government Companies and Corporations; ","(a) A-III, B-II, C-IV and D-I","(b) A-I, B-III, C-IV and D-II","(c) A-III, B-I, C-IV and D-II","(d) A-I, B-II, C-III and D-IV",C,
" 14. Pick the correct one i. Section 20 (1) deals with audit the accounts of such authority or body if the CAG is requested in this behalf, after prior consultation, by the President or the Governor of State/Administrator of a Union Territory having a Legislative Assembly, on such terms and conditions as may be agreed upon between the CAG and the Government concerned ii. Section 20 (2) empowers the President or the Governor of a State or the Administrator of a Union Territory having a Legislative Assembly to entrust the CAG to undertake the audit of the accounts of anybody or authority, not entrusted to the CAG for audit, with the prior approval of the CAG, if the President or the Governor of a State or the Administrator of a Union Territory is of the opinion that such audit is necessary iii. Audit under Sub-sections (1) and (2) of Section 20 of the Act can be entrusted to the CAG only in public interest and only after giving a reasonable opportunity to the concerned authority or body to represent in respect of the proposal for such audit iv. Audit of Government Companies is conducted in accordance with the provisions of the Companies Act, 1956 contained in Sections 617 and 619 and of Corporations set up by or under law made by the Parliament, in accordance with provisions of the respective Legislations","(a) i, ii and iii ","(b) i, iii and iv ","(c) ii, iii and iv ",(d) All of the above,B,
" 15. Pick the correct one i. Section 19 (1)- Audit of Government Companies is conducted in accordance with the provisions of the Companies Act, 1956 contained in Sections 617 and 619ii. Section 19(2)- Audit of Corporations set up by or under law made by the Parliament, in accordance with provisions of the respective Legislations iii. Section 19 (3)- Audit of a Corporation established by law by the Legislature of a State or Union Territory can be entrusted to the CAG in the public interest by the Governor of the State or the Administrator of the Union Territory concerned after consultation with the CAG iv. Section 19A- The reports of the CAG in relation to the accounts of a Government Company or a Corporation audited under Section 19 are to be submitted to the Government or Governments concerned for being laid before the Parliament/legislature","(a) i, ii and iii ","(b) ii, iii and iv ","(c) i, ii and iv ",(d) All of the above,D,
 16. Pick the correct one ,"(a) Section 18 (1) of the DPC Act requires the person in charge of the office or department, the accounts of which are to be inspected and audited by the CAG, to afford all facilities for such inspection and to comply with requests for information in as complete a form as possible and with all reasonable expedition ","(b) Section 18 (2) of the DPC Act empowers the CAG to Inspect any office of accounts under the control of the Union or of a State, to require that any accounts, books, paper and other documents which deal with or form the basis of or are otherwise relevant to the transactions to which his duties in respect of audit extend and to pose such questions or make such observations as the CAG may consider necessary to the person in charge of the office and to call for such information as the CAG may require for the preparation of any account or report which it is his duty to prepare. ",(c) None of the above ,(d) Both of the above,C,
 17. Pick the incorrect one ,"(a) Section 22- The Indian Audit and Accounts Department, functioning under the CAG, derives its authority and the powers for performance of its duties on his behalf ",(b) Section 23- The CAG is authorised to make regulations for carrying into effect the provisions of the DPC Act. ,"(c) Section 24- The CAG is authorised to dispense with, when circumstances so warrant, any part of detailed audit of any account or class of transactions and to apply such limited checks in relation to such accounts or transactions as the CAG may determine under Section ",(d) None of the above.,A,
 18. Pick the incorrect one,(a) IFAC- International Federation of Auditors,(b) IAPC- International Auditing Practices Committee,(c) INTOSAI-International Organisation of Supreme Audit Institutions ,(d) ISA- International Standards on Auditing,A,
" 19. Pick the correct one i. The Auditing Standards Committee of the International Organisation of Supreme Audit Institutions (INTOSAI) issued the Auditing Standards at the XIVth Congress of INTOSAI in 1992 in New Delhi as amended by the XVth Congress of INTOSAI in 1995 in Cairo, Egypt.ii. The Auditing Standards Committee of the International Organisation of Supreme Audit Institutions (INTOSAI) issued Code of Ethics for auditors in the public sector in 1998.iii. While they do not have mandatory application, they reflect a “best practices” consensus among the Supreme Audit Institutions (SAIs) and each SAI is required to judge the extent to which the Standards are compatible with the achievement of its mandate. iv. INTOSAI Standards will continue to provide the necessary framework and overriding principles for financial audit by SAIs","(a) i, ii and iii ","(b) ii, iii and iv ","(c) i, ii and iv ",(d) All of the above,B,
" 20. State whether true or false:  In SAI, India, Auditing Standards of the CAG of India were first issued in 1994. The Standards were comprehensively restructured and updated in a second edition of the Auditing Standards issued in 2002. These Standards are in harmony with the International Standards on Auditing (ISAs) issued by IFAC.",(a) True,(b) False,,,A,
" 21. i. The Auditing Standards of the CAG of India comprise of General Standards, Field Standards, Reporting Standards and Follow-up reporting. ii. The General Standards are concerned with the relationship of the auditor to the audited organisation and with the personal conduct of the auditor in carrying out the audit iii. The Field Standards regulate the audit activity. iv. The Reporting Standards regulate what the auditor has to say after completing the audit. v. The Follow-up Standards regulate the department activity in pursuing reply to inspection report. ","(a) i, ii, iii and iv ","(b) ii, iii and iv ","(c) i, ii, iii and v ",(d) All of the above.,B,
 22. The objective of Financial Audit has been categorised into ,(a) The primary objective of financial audit ,(b) The primary objectives of financial audit and objectives which might be set by the CAG or Statute ,(c) The primary objective of financial audit and the general audit objective of any financial audit. ,"(d) . The primary objectives of financial audit, objectives which might be set by the CAG or Statute and the general audit objective of any financial audit",D,
" 23. Pick the correct one i. The Primary objective of financial audit is the ""expression of an opinion"" on the financial statements. ii. The CAG’s objectives may determine the way the financial audit is carried out reflecting his audit mandate and policy. iii. The CAG of India may set his audit objectives taking into account the provisions of the Constitution of India, the CAG’s DPC Act, 1971 and any governing legislation. iv. The general audit objectives determine the responsibility of an auditor, before certifying an account, to make sure that competent, relevant and reasonable evidence was obtained to support the auditor’s judgement and conclusions. ","(a) i, ii and iii ","(b) i, iii and iv ","(c) ii, iii and iv ",(d) All of the above,D,
 24. Assertions in Financial Statements means,(a) Primary audit objective ,(b) CAG’s audit objective,(c) General audit objective ,(d) All of the above,C,
 25. Assertions are,(a) positive statements about the state of being,(b) negative statements about the state of being ,(c) positive statements about the state of not being,(d) negative statements about the state of not being,A,
 26. There are five general audit objectives for receipts and payments or income and expenditure account items. Pick the correct one i. Relevant ii. Completeness iii. Occurrence iv. Measurement v. Disclosure v. Regularity vii. Availability ,"(a) i, ii, iii, iv and v","(b) ii, iii, iv, v and vi ","(c) i, ii, iv, v and vi","(d) i, ii, v, vi and vii",B,
 27. Pick the incorrect one,(a) Completeness: all transactions relevant to the year of account have been recorded; Occurrence: all recorded transactions occurred and were relevant to the year of account. ,"(b) Measurement: the recorded transactions have been correctly valued, properly calculated, or measured in accordance with established accounting policies, on an acceptable and consistent basis. ",(c) Disclosure: the recorded transactions have been properly classified and disclosed where appropriate,(d) Regularity: the recorded transactions are in chronological and on regular basis of their occurrence.,D,
 28. The assertion that directly tests for potential overstatement of figures in the accounts is ,(a) Occurrence/Existence ,(b) Measurement/Valuation,(c) Completeness/Ownership ,(d) Disclosure/Regularity,A,
 29. The general audit objectives in respect of balance sheet or items of assets and liabilities are,(a) Three ,(b) Four,(c) Five,(d) Seven,C,
 30. Pick the correct general audit objectives in respect of balance sheet or items of assets and liabilities i. Completeness ii. Relevant iii. Existence iv. Valuation v. Disclosure v. Regularity vii. Ownership,"(a) i, ii, iii, iv and v","(b) ii, iii, iv, v and vi ","(c) i, ii, iv, v and vi","(d) i, iii, iv, v and vii",D,
 31. Misclassification of revenue expenditure as capital expenditure is an example of,(a) Completeness objective ,(b) Measurement Objective ,(c) Disclosure Objective,(d) Regularity objective,C,
 32. The audit opinion provides ,(a). reasonable assurance that the financial statements are free from material misstatement and irregularity ,(b). absolute assurance that the financial statements are free from material misstatement and irregularity ,(c). reasonable and absolute assurance that the financial statements are free from material misstatement and irregularity ,"(d) reasonable, reliable and absolute assurance that the financial statements are free from material misstatement and irregularity",A,
 33. Pick the incorrect one ,"(a) A matter is, therefore, considered material if its omission or misstatement would reasonably influence the decision of an intended user of the audit report. ","(b) Materiality should be considered by Audit when determining the nature, timing and extent of audit procedures and evaluating the effect of misstatements. ","(c) These are sometimes known as ""planning materiality"", “Field Materiality” and ""reporting materiality""",(d) None of the given.,C,
" 34. Thus, materiality is of ",(a) two kinds-Materiality by Value and Materiality by Nature ,"(b) three kinds-Materiality by Value, Materiality by Nature and Materiality by Context ","(c) four kinds- Materiality by Value, Materiality by Nature, Materiality by period and Materiality by Context ","(d) five kinds- Materiality by Value, Materiality by Nature, Materiality by period, Materiality by population and Materiality by Context",B,
" 35. i. The materiality thresholds depend on the basis of accounts and their sensitivity.ii. Materiality is a relative term and requires the exercise of professional judgment. iii. Materiality should be chosen to reflect the drivers behind the account, and could be expenditure, income, average surplus or asset values.iv. The level of materiality by value is set at the outset of the audit, but should only be considered as a guide. It should not be considered a hard and fast figure. A range of values can be considered for materiality","(a) i, ii and iii ","(b) i, iii and iv ","(c) ii, iii and iv ",(d) All of the above,D,
 36. Pick the correct one ,(a) When deciding on a figure to use as materiality the auditor should be guided by two questions firstly how great is Parliament’s / Legislature’s and other users’ interest likely to be and secondly what are they most likely to be concerned about? ,"(b) The level of interest in the account dictates the sensitivity of the account, more interest in the account results in less error being tolerated ",(c) Both a & b ,(d) None of the given.,C,
 37. Materiality base for the determining materiality percentage for Accounts prepared on Cash Basis i.e. Finance and Appropriation Accounts is,(a) Gross Receipts/ Expenditure ,(b) Net Receipt/Expenditure,(c) Both a & b ,(d) None of the given.,A,
 38. Pick the correct one regarding materiality percentage for Accounts prepared on Cash Basis i.e. Finance and Appropriation Accountsi. Very Sensitive- ½ %ii. Sensitive- ½ % to 2%iii. Not sensitive-2%iv. Less sensitive-2% ,"(a) i, ii and iv ","(b) i, ii and iii",(c) i and ii ,(d) All of the above,B,
 39. For Accounts prepared on Accruals basis the materiality bases arei. Normal net surplus ii. Gross income / expenditureiii. Turnover (Sales) iv. Total assetsv. Net assets,"(a) i, ii, iii and iv ","(b) ii, iii, iv and v ","(c) i, iii, iv and v ",(d) All of the above,D,
" 40. For Accounts prepared on Accruals basis, taking into various materiality base the range of percentage of materiality from very sensitive to not sensitive is",(a) ½ % to 5% ,(b) ½ % to 7 ½ %,(c) ½ % to 10% ,(d) ½ to 15%,C,
 41. State whether true or false: It is necessary to set separate materiality levels for different financial statements like the Balance Sheet and Income and Expenditure Account,(a) True,(b) False,,,B,
" 42. The budgetary excesses, misclassification between voted and charged expenditure, chief executive’s salary, the cash balance, Auditor's remuneration and details of special payments, write-offs and losses are the examples of",(a) materiality by value,(b) materiality by context,(c) materiality by nature,(d) All of the above.,C,
" 43. Due to a misstatement, the financial statements indicate that a department has savings when it has, in fact, exceeded its budget, it will become material",(a) by context ,(b) by nature ,(c) by value ,(d) by exception,A,
" 44. Pick the correct one i. Planning materiality is primarily concerned with materiality by value. At this stage highest amount which would not distort the overall view of the accounts given to the addressee of the audit report. ii. The materiality of errors by nature and by context is a matter to be considered specifically at the end of the audit. At the planning stage, the possibility of such errors occurring should be recognised by ensuring that audit programmes include year-end procedures to detect them. iii. Reporting materiality applies at the end of the audit when all errors are evaluated and viewed in relation to their known effects on the financial statements. At this stage, the Auditor has to consider the audit findings by value, by nature and by context, and errors or omissions may be considered material which otherwise by value would not. iv. As a matter of abundant caution, planning materiality may be taken at a higher figure than reporting materiality.","(a) i, ii and iii ","(b) i, iii and iv ","(c) ii, iii and iv ",(d) All of the above,A,
 45. i. Most likely error is a term used in planning and evaluating the results of audit.ii. In planning it is more properly known as advanced most likely error (AMLE) and is the error the auditors predict they will find as a result of audit testing based on the errors found in the previous year’s audit. iii. Precision represents the degree of uncertainty in the auditor’s estimate of error (the MLE).iv. It is a range of error that auditors could accept in the account between MLE and materiality,"(a) i, ii and iii ","(b) i, iii and iv ","(c) ii, iii and iv ",(d) All of the above,B,
" 46. State whether true or false: As auditors cannot be sure that the errors predicted and found in testing are the only errors in the account, the sample chosen should ensure that the auditors can be 95% sure that they have found any error.",(a) True,(b) False,,,A,
" 47. i. Precision forms the basis of the calculation used to determine the sample size which should be tested by auditors to gain audit assurance.ii. If auditors base their sample sizes on materiality and AMLE alone, this would allow no room for the unexpected errors the auditors could find. Auditors, therefore, set a level for precision between 80% and 90% of the possible range between AMLE and materiality. iii.The auditors should ensure that the level of error predicted in the account is a genuine estimate. If there is an over-estimation of the level of error anticipated in the account, a smaller precision increases sample sizes and this usually leads to too much work being done. iv. If the auditors anticipate very low levels of error and find more errors than planned for, this may cause problems in extrapolation.","(a) i, ii and iii ","(b) i, iii and iv ","(c) ii, iii and iv ",(d) All of the above,D,
 48. Precision is calculated as,(a) (Materiality + Anticipated Most Likely Error) x Range of error possible but with no room for unexpected error ,(b) (Materiality + Anticipated Most Likely Error) x Range of error possible but with room for unexpected error ,(c) (Materiality – Anticipated Most Likely Error) x Range of error possible but with no room for unexpected error ,(d) (Materiality – Anticipated Most Likely Error) x Range of error possible but with room for unexpected error,C,
 49. Precision is used in,(a) the calculation of the size of non-statistical sample drawn and the evaluation of the results of testing the sample. ,(b) the calculation of the size of statistical sample drawn and the evaluation of the results of testing the sample. ,"(c) the calculation of population, materiality and the size of statistical sample drawn and the evaluation of the results of testing the sample. ","(d) . the calculation of population, materiality and the size of non-statistical sample drawn and the evaluation of the results of testing the sample.",B,
 50. The normal level or percentage of assurance (confidence) and risk in auditing is,(a) Assurance 80% Risk 20% ,(b) Assurance 85% Risk 15% ,(c) Assurance 90% Risk 10% ,(d) Assurance 95% Risk 5%,D,
" 51. Audit risk has three components, pick the incorrect one ",(a) Hidden risk-is the risk that a misstatement that could occur in an account balance or class of transactions and that could be material individually or when aggregated with misstatements in other balances or classes due to the hidden weakness of the system.,"(b) Inherent risk- is the susceptibility of an account balance or class of transactions to misstatement that could be material, individually or when aggregated with misstatements in other balances or classes, assuming that there were no related internal controls. ","(c) Control risk- is the risk that a misstatement that could occur in an account balance or class of transactions and that could be material individually or when aggregated with misstatements in other balances or classes, will not be prevented or detected and corrected on a timely basis by the accounting and internal control systems","(d) Detection risk- is the risk that an auditor’s substantive procedures will not detect a misstatement that exists in an account balance or class of transactions that could be material, individually or when aggregated with misstatements in other balances or classes",A,
 52. Audit risk is ,(a) Inherent Risk + Control Risk + Detection Risk ,(b) Inherent Risk X Control Risk X Detection Risk,(c) Inherent Risk X Control Risk + Detection Risk ,(d) Inherent Risk + Control Risk - Detection Risk,B,
 53. Anything which has an influence on whether or not an error is likely to occur in the first place is called ,(a) Audit Environment,(b) Audit Matrix,(c) Accounting Environment,(d) Accounting Matrix,C,
 54. Previous history of non-production of records to audit is an example of ,(a) Control Risk ,(b) Exceptional Risk,(c) Detection Risk,(d) Inherent Risk.,D,
" 55. As per the Auditing Standards, the auditor in support his judgement and conclusions should obtain audit evidence that should be",(a) Competent and relevant,"(b) competent, relevant and reasonable ","(c) Complete, competent, relevant and reasonable ","(d) Complete, competent, relevant, reliable and reasonable",B,
" 56. State whether true or false: The principal source of evidence for audit conclusions will be the records of the auditee. It is the primary duty of Audit to ensure that evidence is planned, gathered and analysed after any conclusion can be reached",(a) True,(b) False,,,B,
" 57.Evidence may be gather byi. physical observation, including joint inspection ii. confirmation, enquiry and survey iii. evaluation of the quality of internal control mechanisms iv. interviews with executives v. computer assisted audit techniques (CAATs) and analytical anaylsis.","(a) i, ii and iii ","(b) i, ii, iii and iv ","(c) i, ii, iii and v ",(d) All of the above,D,
